{
  "URL": "https://v8-perf.skia.org",
  "contact": "https://bugs.chromium.org/p/v8/issues/list?q=component%3ATools&can=2",
  "trace_sample_proportion": 0.01,
  "notify_config": {
    "notifications": "html_email"
  },
  "auth_config": {
    "header_name": "X-WEBAUTH-USER"
  },
  "data_store_config": {
    "datastore_type": "cockroachdb",
    "connection_string": "postgresql://root@perf-cockroachdb3-public:26277/v8?sslmode=disable",
    "tile_size": 256
  },
  "ingestion_config": {
    "source_config": {
      "source_type": "gcs",
      "project": "skia-public",
      "topic": "perf-ingestion-v8-production-restore",
      "subscription": "perf-ingestion-v8-production-restore-prod",
      "sources": [
        "gs://v8_perf_skia_prod/v8/cq/",
        "gs://v8_perf_skia_prod/v8/chromeperf/"
      ]
    },
    "branches": [],
    "file_ingestion_pubsub_topic_name": ""
  },
  "git_repo_config": {
    "provider": "gitiles",
    "url": "https://chromium.googlesource.com/v8/v8.git",
    "dir": "/tmp/v8",
    "debounce_commit_url": false
  },
  "query_config": {
    "default_url_values": {
      "plotSummary": "true",
      "showZero": "false"
    }
  }
}