{
    "URL": "https://flutter-engine-perf.skia.org",
    "contact": "https://mail.google.com/chat/u/0/?zx=s88snihcl7ie#chat/space/AAAAm69vf-M",
    "feedback_url": "https://issuetracker.google.com/issues/new?component=1547614&template=1970127",
    "trace_sample_proportion": 0.01,
    "notify_config": {
        "notifications": "html_email"
    },
    "auth_config": {
        "header_name": "X-WEBAUTH-USER"
    },
    "data_store_config": {
        "datastore_type": "cockroachdb",
        "connection_string": "postgresql://root@perf-cockroachdb3-public:26277/flutter_engine2?sslmode=disable",
        "tile_size": 4096
    },
    "ingestion_config": {
        "source_config": {
            "source_type": "gcs",
            "project": "skia-public",
            "topic": "perf-ingestion-flutter-engine2",
            "subscription": "perf-ingestion-flutter-engine2-cdb-prod",
            "sources": [
                "gs://flutter-skia-perf-prod/flutter-engine"
            ],
            "reject_if_name_matches": ".lock$"
        },
        "branches": [],
        "file_ingestion_pubsub_topic_name": ""
    },
    "git_repo_config": {
        "provider": "git",
        "url": "https://github.com/flutter/engine",
        "dir": "/tmp/flutter-engine",
        "debounce_commit_url": false,
        "commit_url": "%s/commit/%s"
    }
}