{
    "URL": "https://chrome-perf.corp.goog",
    "landing_page_rel_path": "/m/",
    "header_image_url": "/dist/images/chrome-logo.svg",
    "ga_measurement_id": "G-PFC9BX9411",
    "allowed_hosts": [],
    "backend_host_url": "perf-be-chrome-non-public.perf.svc.cluster.local:8000",
    "contact": "browser-perf-engprod@google.com",
    "instance_name": "chrome-internal",
    "trace_sample_proportion": 0.1,
    "invalid_param_char_regex": "([^a-zA-Z0-9!~@#$%^&*()+ :\\._\\-])",
    "fetch_chrome_perf_anomalies": true,
    "enable_only_regressions_option": true,
    "enable_split_all_option": true,
    "use_regression2_schema": true,
    "bug_host_url": "https://issues.chromium.org",
    "feedback_url": "http://go/berf-skia-feedback",
    "chat_url": "http://go/berf-skia-chat",
    "filter_parent_traces": true,
    "notify_config": {
        "notifications": "anomalygroup"
    },
    "issue_tracker_config": {
        "notification_type": "issuetracker",
        "issue_tracker_api_key_secret_project": "skia-infra-public",
        "issue_tracker_api_key_secret_name": "perf-issue-tracker-apikey"
    },
    "anomaly_config": {
        "default_refiner": "anomaly_bounds"
    },
    "auth_config": {
        "header_name": "X-WEBAUTH-USER"
    },
    "data_store_config": {
        "datastore_type": "spanner",
        "connection_string": "postgresql://root@localhost:5432/chrome_int?sslmode=disable",
        "tile_size": 8192,
        "enable_follower_reads": true,
        "min_db_connections": 5
    },
    "experiments": {
        "enable_skia_bridge_aggregation": true,
        "df_iter_trace_slicer": true,
        "regressions_trace_id_field": true
    },
    "ingestion_config": {
        "source_config": {
            "source_type": "gcs",
            "project": "skia-public",
            "topic": "perf-ingestion-chrome-internal-spanner",
            "subscription": "perf-ingestion-chrome-internal-spanner-prod",
            "dl_topic": "perf-ingestion-chrome-non-public-dl",
            "dl_subscription": "perf-ingestion-chrome-non-public-dl-prod",
            "sources": [
                "gs://chrome-perf-non-public/ingest"
            ]
        },
        "branches": [],
        "file_ingestion_pubsub_topic_name": "perf-cluster-chrome-non-public"
    },
    "maintenance_config": {
        "gitiles_repo_url": "https://chrome-internal.googlesource.com/infra/infra_internal",
        "sheriff_config_path": "infra/config/subprojects/skiaperf/chrome-internal.textpb",
        "fallback_to_lucicfg": false
    },
    "git_repo_config": {
        "provider": "gitiles",
        "url": "https://chromium.googlesource.com/chromium/src",
        "dir": "/tmp/checkout",
        "debounce_commit_url": false,
        "start_commit": "b7fa4587f55a066e97f79b4c97ed785dc217064b",
        "commit_number_regex": "Cr-Commit-Position: refs/heads/(main|master)@\\{#(.*)\\}"
    },
    "extra_links": {
        "name": "CBB",
        "title": "Comparative Browser Benchmarking (CBB)",
        "links": [
            {
                "text": "Mac M3 (go/cbb-mac or go/cbb-mac-m3)",
                "href": "https://chrome-perf.corp.goog/m?begin=1752000000&end=1798761600&numCommits=50&shortcut=734af8a7b2b3ac5357d8b3f1edccadeb&splitByKeys=benchmark",
                "description": "CBB results on Mac M3 Pro"
            },
            {
                "text": "Mac M4 (go/cbb-mac-m4)",
                "href": "https://chrome-perf.corp.goog/m?begin=1752000000&end=1798761600&numCommits=50&shortcut=77516ea5ecb61920085a3bc36bed6ca4&splitByKeys=benchmark",
                "description": "CBB results on Mac M4 Mini"
            },
            {
                "text": "Mac M5 (go/cbb-mac-m5)",
                "href": "https://chrome-perf.corp.goog/m?begin=1752000000&end=1798761600&numCommits=50&shortcut=0c609ef4fdee51b42a8a023b41779635&splitByKeys=benchmark",
                "description": "CBB results on Mac M5 Pro"
            },
            {
                "text": "Windows x64 (go/cbb-win)",
                "href": "https://chrome-perf.corp.goog/m?begin=1752000000&end=1798761600&numCommits=50&shortcut=6f8219f904ec038dc053b4eb8235625c&splitByKeys=benchmark",
                "description": "CBB results on Windows (Intel CPU)"
            },
            {
                "text": "Windows ARM64 (go/cbb-win-arm)",
                "href": "https://chrome-perf.corp.goog/m?begin=1752000000&end=1798761600&numCommits=50&shortcut=fb55617bcb42fb3727c46574389450ac&splitByKeys=benchmark",
                "description": "CBB results on Windows (ARM64 CPU)"
            },
            {
                "text": "Pixel Tablet (go/cbb-tangor)",
                "href": "https://chrome-perf.corp.goog/m?begin=1752000000&end=1798761600&numCommits=35&shortcut=add89a0b363e5b55fefee9d1deb614b4&splitByKeys=benchmark",
                "description": "CBB results on Pixel Tablet (Tangor)"
            },
            {
                "text": "Pixel 10 (go/cbb-pixel10)",
                "href": "https://chrome-perf.corp.goog/m?begin=1752000000&end=1798761600&numCommits=35&shortcut=7118857dadc8a6de3e0856b37b94efc8&splitByKeys=benchmark",
                "description": "CBB results on Pixel 10"
            },
            {
                "text": "Speedometer3 (go/cbb-sp3)",
                "href": "https://chrome-perf.corp.goog/m?begin=1752000000&end=1798761600&numCommits=50&shortcut=cb8524bef9eb7a24893f1cc23b356340&splitByKeys=bot",
                "description": "CBB Speedometer3 results"
            },
            {
                "text": "JetStream2 (go/cbb-js2)",
                "href": "https://chrome-perf.corp.goog/m?begin=1752000000&end=1798761600&numCommits=50&shortcut=e1af395c5bcc2a519ccc02bcf45e2e2a&splitByKeys=bot",
                "description": "CBB JetStream2 results"
            },
            {
                "text": "JetStream3 (go/cbb-js3)",
                "href": "https://chrome-perf.corp.goog/m?begin=1752000000&end=1798761600&numCommits=50&shortcut=035adbbad4f91e0c16cf62f057ce8f80&splitByKeys=bot",
                "description": "CBB JetStream3 results"
            },
            {
                "text": "MotionMark (go/cbb-mm)",
                "href": "https://chrome-perf.corp.goog/m?begin=1752000000&end=1798761600&numCommits=50&shortcut=dfc214ce1db4237f61c8ac772a3c084f&splitByKeys=bot",
                "description": "CBB MotionMark results"
            },
            {
                "text": "Loadline 2 (go/cbb-ll)",
                "href": "https://chrome-perf.corp.goog/m/?begin=1752000000&end=1798761600&numCommits=20&shortcut=84ec45803be2ac833b6724c19e4c9110&splitByKeys=bot",
                "description": "CBB Loadline 2 results (Android only)"
            },
            {
                "text": "Overall results (go/cbb-all)",
                "href": "https://chrome-perf.corp.goog/m?begin=1752000000&end=1798761600&numCommits=50&shortcut=65dbfddc43f92482be5c6e97023ad2d9&splitByKeys=benchmark",
                "description": "CBB results for all benchmarks and platforms"
            }
        ]
    },
    "query_config": {
        "include_params": [
            "benchmark",
            "bot",
            "test",
            "subtest_1",
            "subtest_2",
            "subtest_3"
        ],
        "default_param_selections": {
            "stat": ["value"]
        },
        "default_url_values": {
            "plotSummary": "true",
            "useTestPicker": "true",
            "showZero": "false",
            "enable_chart_tooltip": "true",
            "use_titles": "true",
            "show_google_plot": "true"
        },
        "default_range": 604800,
        "cache_config": {
            "type": "redis",
            "level1_cache_key": "benchmark",
            "level2_cache_key": "bot",
            "enabled": true
        },
        "redis_config": {
            "project": "skia-infra-corp",
            "zone": "us-central1",
            "instance": "chrome-internal",
            "cache_expiration_minutes": 300
        }
    },
    "data_point_config": {
        "keys_for_commit_range": ["V8", "WebRTC", "V8 Git Hash", "WebRTC Git Hash"],
        "keys_for_useful_links": [
            "Build Page", "Tracing uri", "Browser Version", "Workflow", "Swarming Tasks"],
        "skip_commit_detail_display": true,
        "show_json_file_display": false
    },
    "temporal_config": {
        "host_port": "temporal.temporal:7233",
        "namespace": "perf-internal",
        "grouping_task_queue": "perf.perf-chrome-internal.grouping",
        "pinpoint_task_queue": "perf.perf-chrome-public.bisect"
    },
    "enable_sheriff_config": true,
    "help_url_override": "http://go/chrome-perf-user-doc",
    "trace_format": "chrome",
    "need_alert_action": true,
    "optimize_sqltracestore": true,
    "new_alerts_page": true,
    "show_triage_link": false,
    "show_bisect_btn": true,
    "allow_multiple_regressions_per_alert_id": true,
    "visibility_config": {
        "provider_name": "chrome",
        "sources": {
            "chrome_bot": {
                "git_repo": "https://chromium.googlesource.com/chromium/src",
                "path": "tools/perf/public_builders.json",
                "rule_prefix": "bot="
            }
        }
    }
}
