{
  "URL": "https://v8-perf.luci.app",
  "header_image_url": "/dist/images/v8.svg",
  "contact": "https://bugs.chromium.org/p/v8/issues/list?q=component%3ATools&can=2",
  "instance_name": "V8 (Public)",
  "ga_measurement_id": "G-L2RB15ST9C",
  "feedback_url": "https://issuetracker.google.com/issues/new?component=1547614&template=1970127",
  "trace_sample_proportion": 0.01,
  "enable_only_regressions_option": true,
  "enable_split_all_option": true,
  "notify_config": {
    "notifications": "html_email"
  },
  "auth_config": {
    "header_name": "X-WEBAUTH-USER"
  },
  "data_store_config": {
    "datastore_type": "spanner",
    "connection_string": "postgresql://root@localhost:5432/v8?sslmode=disable",
    "tile_size": 256,
    "min_db_connections": 5
  },
  "experiments": {
  },
  "ingestion_config": {
    "source_config": {
      "source_type": "gcs",
      "project": "skia-public",
      "topic": "perf-ingestion-v8-production-spanner",
      "subscription": "perf-ingestion-v8-production-spanner-prod",
      "sources": [
        "gs://v8_perf_skia_prod/v8/cq/",
        "gs://v8_perf_skia_prod/v8/chromeperf/"
      ]
    },
    "branches": [],
    "file_ingestion_pubsub_topic_name": ""
  },
  "git_repo_config": {
    "provider": "gitiles",
    "url": "https://chromium.googlesource.com/v8/v8.git",
    "dir": "/tmp/v8",
    "debounce_commit_url": false
  },
  "query_config": {
    "include_params": [
      "benchmark",
      "bot",
      "test",
      "subtest",
      "subtest_2",
      "aggregation",
      "metric",
      "unit",
      "v8_mode",
      "wasm_mode",
      "js_mode"
    ],
    "default_url_values": {
      "plotSummary": "true",
      "showZero": "false",
      "useTestPicker": "true",
      "enable_chart_tooltip": "true",
      "use_titles": "true",
      "show_google_plot": "true"
    },
    "query_commit_chunk_size": 10000
  },
  "new_alerts_page": true,
  "optimize_sqltracestore": true,
  "show_triage_link": true,
  "show_bisect_btn": true
}
